{
    "ProjectName": "junit-csharp-webgoat",
    "ProgrammingLanguage": "CSharp",
    "ScanAppType": "Configuration, Csharp, PmTaint",
    "IsUsePublicAnalysisMethod": true,
    "IsDownloadDependencies": true,
    "CustomParameters": null,
    "ProjectType": "Solution",
    "UseSecurityPolicies": false,
    "UseCustomYaraRules": false,
    "UseSastRules": false
}
